{"appId":"org.example.uptime-demo","license":"MIT","name":"Uptime Demo","provenance":{"applicationScope":"org.example.uptime-demo","authorityLevel":"wazi-reviewed","confidence":0.95,"contentHash":"sha256:1111111111111111111111111111111111111111111111111111111111111111","expiresAt":"2027-10-21T08:00:00Z","extractionMethod":"deterministic-parser","observedAt":"2026-10-21T08:00:00Z","sensitivity":"public","sourceId":"src_demo_repo","sourceType":"official-repository","versionScope":"1.0.0"},"release":{"backup":{"procedureRef":"proc_backup_uptime_demo","restoreVerified":true,"supported":true},"environment":[{"name":"APP_SECRET","secretRef":"secret://deployment/app-secret"}],"healthCheck":{"intervalSeconds":15,"retries":4,"target":"http://localhost:3000/health","timeoutSeconds":5,"type":"http"},"images":[{"digest":"sha256:2222222222222222222222222222222222222222222222222222222222222222","image":"ghcr.io/example/uptime-demo","service":"app"}],"ports":[{"containerPort":3000,"exposure":"public","hostPort":3000,"service":"app"}],"rollback":{"notes":"Restore app-data volume from pre-upgrade checkpoint, then compose down/up on prior digest.","procedureRef":"proc_rollback_uptime_demo","supported":true},"volumes":[{"backup":true,"mountPath":"/data","name":"app-data"}]},"requirements":{"architectures":["x86_64"],"minComposeVersion":"2.20.0","minCpuCores":1,"minDockerVersion":"24.0.0","minRamMb":512,"minStorageMb":1024,"osFamilies":["linux"],"privileged":false},"reviewState":"signed","schemaVersion":"1.0.0","signature":{"algorithm":"sigstore-cosign","payloadDigest":"sha256:209bf88b0aad8e0ae9a0263a578a882fae793f23c2d6362fcbd03665ba0e6d3f","signedBy":"cosign-v3.1.4-fixture","value":"MEQCIDQYNz5cVWJGWhXv50jNG7M1NMp23n3jUfmkgJdEtqU2AiB/Q+ULCwu8bBSCtXuHpdvbCUlmqZQ0b0Hbr429dc3Veg=="},"version":"1.0.0"}